{
  "eventId": "11111111-1111-4111-8111-111111111111",
  "eventType": "TASK_REQUESTED",
  "schemaVersion": 1,
  "occurredAt": "2026-09-25T08:00:00Z",
  "mediaId": "22222222-2222-4222-8222-222222222222",
  "taskId": "33333333-3333-4333-8333-333333333333",
  "generation": 1,
  "aggregateVersion": 1,
  "requestId": "44444444-4444-4444-8444-444444444444",
  "traceId": "55555555-5555-4555-8555-555555555555",
  "producerInvocationId": "66666666-6666-4666-8666-666666666666",
  "causationEventId": null,
  "payload": {"preset": "MP4_720P_V1"}
}
